{
  "version": "0.1.0",
  "lastUpdated": "2026-03-08",
  "nodes": [
    {
      "id": "african-roots",
      "label": "African Roots",
      "type": "domain",
      "summary": "The foundational musical traditions of Africa and the African diaspora — spirituals, work songs, and field hollers that seeded blues, jazz, gospel, and virtually all popular music.",
      "tags": ["africa", "diaspora", "oral-tradition"],
      "metadata": { "added": "2026-03-08", "importance": 1, "status": "seed" }
    },
    {
      "id": "classical-western",
      "label": "Classical Western",
      "type": "domain",
      "summary": "The European art music tradition spanning from medieval plainchant through Baroque, Classical, Romantic, and into 20th-century modernism and minimalism.",
      "tags": ["classical", "europe", "art-music"],
      "metadata": { "added": "2026-03-08", "importance": 1, "status": "seed" }
    },
    {
      "id": "rock",
      "label": "Rock",
      "type": "domain",
      "summary": "Born from blues, gospel, and country in the 1950s, rock music became the dominant popular music form of the 20th century, branching into dozens of subgenres.",
      "tags": ["rock", "guitar", "popular-music"],
      "metadata": { "added": "2026-03-08", "importance": 1, "status": "seed" }
    },
    {
      "id": "electronic",
      "label": "Electronic",
      "type": "domain",
      "summary": "Music primarily produced with electronic instruments, synthesizers, drum machines, and digital audio workstations — from early experiments to global dance culture.",
      "tags": ["electronic", "synthesizer", "dance"],
      "metadata": { "added": "2026-03-08", "importance": 1, "status": "seed" }
    },
    {
      "id": "hip-hop",
      "label": "Hip-Hop",
      "type": "domain",
      "summary": "A cultural movement and music genre born in the Bronx in 1973, built on DJing, MCing, breakdancing, and graffiti — now the world's most consumed music genre.",
      "tags": ["hip-hop", "rap", "bronx", "culture"],
      "metadata": { "added": "2026-03-08", "importance": 1, "status": "seed" }
    },
    {
      "id": "jazz-blues",
      "label": "Jazz & Blues",
      "type": "domain",
      "summary": "The twin pillars of African-American music — blues rooted in field hollers and spirituals, jazz in improvisation and harmonic complexity. Together they shaped the 20th century.",
      "tags": ["jazz", "blues", "african-american", "improvisation"],
      "metadata": { "added": "2026-03-08", "importance": 1, "status": "seed" }
    },
    {
      "id": "latin",
      "label": "Latin",
      "type": "domain",
      "summary": "The rich musical traditions of Latin America and the Caribbean — from Cuban son and Brazilian samba to Argentine tango and modern reggaeton.",
      "tags": ["latin", "caribbean", "south-america"],
      "metadata": { "added": "2026-03-08", "importance": 1, "status": "seed" }
    },
    {
      "id": "world",
      "label": "World",
      "type": "domain",
      "summary": "Musical traditions from Jamaica, East Asia, South Asia, and Iberia that cross-pollinated with Western popular music to create globally influential genres.",
      "tags": ["world", "global", "cross-cultural"],
      "metadata": { "added": "2026-03-08", "importance": 1, "status": "seed" }
    },

    {
      "id": "african-roots/west-african-music",
      "label": "West African Music",
      "type": "topic",
      "summary": "The polyrhythmic, call-and-response vocal traditions of West Africa — griot storytelling, drumming circles, and pentatonic scales that enslaved Africans carried to the Americas.",
      "tags": ["west-africa", "polyrhythm", "griot", "oral-tradition"],
      "metadata": { "added": "2026-03-08", "importance": 1, "status": "seed" }
    },
    {
      "id": "african-roots/spirituals",
      "label": "Spirituals",
      "type": "topic",
      "summary": "Sacred songs created by enslaved African Americans, blending African musical traditions with Christian hymns. Coded messages of resistance and hope that laid groundwork for gospel and blues.",
      "tags": ["spirituals", "sacred", "slavery", "resistance"],
      "metadata": { "added": "2026-03-08", "importance": 1, "status": "seed" }
    },
    {
      "id": "african-roots/work-songs",
      "label": "Work Songs",
      "type": "concept",
      "summary": "Rhythmic songs sung by enslaved and later free Black laborers to coordinate physical work. Their call-and-response structure and blue notes fed directly into the blues.",
      "tags": ["work-songs", "labor", "call-and-response"],
      "metadata": { "added": "2026-03-08", "importance": 2, "status": "seed" }
    },
    {
      "id": "african-roots/field-hollers",
      "label": "Field Hollers",
      "type": "concept",
      "summary": "Solo vocal cries sung by enslaved field workers in the American South. Their melismatic, improvised melodies and bent notes are direct precursors to the blues vocal style.",
      "tags": ["field-hollers", "vocal", "improvisation", "south"],
      "metadata": { "added": "2026-03-08", "importance": 2, "status": "seed" }
    },
    {
      "id": "african-roots/afrobeat",
      "label": "Afrobeat",
      "type": "topic",
      "summary": "Genre pioneered by Fela Kuti in Lagos in the late 1960s, fusing Yoruba music and Ghanaian highlife with American funk, jazz, and psychedelic rock. Politically charged and rhythmically complex.",
      "tags": ["afrobeat", "fela-kuti", "nigeria", "funk", "political"],
      "metadata": { "added": "2026-03-08", "importance": 1, "status": "seed" }
    },
    {
      "id": "african-roots/highlife",
      "label": "Highlife",
      "type": "topic",
      "summary": "A Ghanaian and Nigerian popular music genre from the early 20th century, blending local melodies with Western instruments — brass bands, guitars, and jazz harmonies. A key ingredient of Afrobeat.",
      "tags": ["highlife", "ghana", "nigeria", "brass"],
      "metadata": { "added": "2026-03-08", "importance": 2, "status": "seed" }
    },

    {
      "id": "jazz-blues/blues",
      "label": "Blues",
      "type": "topic",
      "summary": "Born in the Deep South around the 1890s-1900s from spirituals, work songs, and field hollers. The 12-bar blues form, blue notes, and call-and-response became the DNA of popular music.",
      "tags": ["blues", "twelve-bar", "deep-south", "blue-notes"],
      "metadata": { "added": "2026-03-08", "importance": 1, "status": "seed" }
    },
    {
      "id": "jazz-blues/delta-blues",
      "label": "Delta Blues",
      "type": "concept",
      "summary": "The earliest recorded blues style, originating in the Mississippi Delta in the 1900s-1920s. Acoustic guitar and slide guitar, raw vocals. Robert Johnson, Charley Patton, Son House.",
      "tags": ["delta-blues", "mississippi", "acoustic", "slide-guitar"],
      "metadata": { "added": "2026-03-08", "importance": 2, "status": "seed" }
    },
    {
      "id": "jazz-blues/chicago-blues",
      "label": "Chicago Blues",
      "type": "concept",
      "summary": "Electrified Delta blues transplanted to Chicago during the Great Migration (1940s-1950s). Muddy Waters, Howlin Wolf, and Little Walter added electric guitar, amplified harmonica, and full bands.",
      "tags": ["chicago-blues", "electric", "great-migration", "muddy-waters"],
      "metadata": { "added": "2026-03-08", "importance": 2, "status": "seed" }
    },
    {
      "id": "jazz-blues/rhythm-and-blues",
      "label": "Rhythm and Blues",
      "type": "topic",
      "summary": "Emerged in the late 1940s as a commercial term for African-American popular music. Combined blues, jazz, and gospel into an upbeat, dance-oriented style that directly birthed rock and roll.",
      "tags": ["rnb", "rhythm-and-blues", "dance", "crossover"],
      "metadata": { "added": "2026-03-08", "importance": 1, "status": "seed" }
    },
    {
      "id": "jazz-blues/jazz",
      "label": "Jazz",
      "type": "topic",
      "summary": "Originated in New Orleans in the 1910s from blues, ragtime, and brass band traditions. Defined by improvisation, swing, and complex harmony. America's classical music.",
      "tags": ["jazz", "new-orleans", "improvisation", "swing"],
      "metadata": { "added": "2026-03-08", "importance": 1, "status": "seed" }
    },
    {
      "id": "jazz-blues/swing",
      "label": "Swing",
      "type": "concept",
      "summary": "The dominant popular music of the 1930s-1940s. Big band jazz with danceable rhythms — Duke Ellington, Count Basie, Benny Goodman. The first truly mass-market American music.",
      "tags": ["swing", "big-band", "dance", "1930s"],
      "metadata": { "added": "2026-03-08", "importance": 2, "status": "seed" }
    },
    {
      "id": "jazz-blues/bebop",
      "label": "Bebop",
      "type": "concept",
      "summary": "A virtuosic, harmonically complex jazz style developed in the mid-1940s by Charlie Parker, Dizzy Gillespie, and Thelonious Monk. Fast tempos, intricate melodies, and improvisation over chord changes.",
      "tags": ["bebop", "charlie-parker", "virtuosity", "1940s"],
      "metadata": { "added": "2026-03-08", "importance": 2, "status": "seed" }
    },
    {
      "id": "jazz-blues/cool-jazz",
      "label": "Cool Jazz",
      "type": "concept",
      "summary": "A relaxed, lyrical response to bebop's intensity, emerging in the late 1940s-1950s. Miles Davis's Birth of the Cool (1957), Dave Brubeck, Chet Baker. West Coast jazz.",
      "tags": ["cool-jazz", "miles-davis", "west-coast", "1950s"],
      "metadata": { "added": "2026-03-08", "importance": 2, "status": "seed" }
    },
    {
      "id": "jazz-blues/hard-bop",
      "label": "Hard Bop",
      "type": "concept",
      "summary": "A grittier, blues- and gospel-inflected extension of bebop, flourishing in the 1950s-1960s. Art Blakey, Horace Silver, Cannonball Adderley. The East Coast response to cool jazz.",
      "tags": ["hard-bop", "art-blakey", "east-coast", "1950s"],